{
  "schema_version": "1.0",
  "decision_id": "openhero-responsive-progressive-gallery-decision",
  "source_bundle_id": "cristianolivera1__openhero__16ffaa7e6dc3",
  "pattern_record_path": "internal/artificer/records/cristianolivera1__openhero__16ffaa7e6dc3/patterns/responsive-progressive-gallery.json",
  "audit_report_id": "openhero-16ffaa7e6dc3-audit",
  "decision_status": "DEFERRED",
  "assigned_specialist": "cloak",
  "reviews": {
    "arbiter": {
      "status": "APPROVED",
      "rationale": "The static and documentation evidence supports the pattern description, reference-only classification, and Cloak assignment. The pattern is technically coherent and does not conflict with the current governance contracts.",
      "review_date": "2026-07-12"
    },
    "governor": {
      "status": "NOT_REQUIRED",
      "rationale": "The audit marks the OpenHero source as MIT and compatible. This deferred decision authorizes no implementation, no OpenHero source reuse, and no media or third-party asset reuse. Any future direct reuse remains subject to normal Governor review and notice preservation.",
      "review_date": "2026-07-12"
    },
    "steward": {
      "status": "REVISION_REQUIRED",
      "rationale": "The pattern is a valid UI reference, but Orchestra has no approved gallery or comparable media-surface requirement that currently justifies proposal and implementation work. A concrete product need, target surface, accessibility requirement, and maintenance case must be established before advancement.",
      "review_date": "2026-07-12"
    }
  },
  "maintainer_decision": {
    "status": "DEFERRED",
    "rationale": "Defer the pattern until Orchestra has an approved UI requirement that benefits from responsive progressive rendering. Preserve it as concept-only reference evidence, but do not include it in the current evolution proposal or implementation scope.",
    "decision_date": "2026-07-12"
  },
  "implementation_restriction": "CONCEPT_ONLY",
  "decision_date": "2026-07-12"
}
