{
  "schema_version": "1.0",
  "decision_id": "openhero-optimistic-engagement-state-reconciliation-decision",
  "source_bundle_id": "cristianolivera1__openhero__16ffaa7e6dc3",
  "pattern_record_path": "internal/artificer/records/cristianolivera1__openhero__16ffaa7e6dc3/patterns/optimistic-engagement-state-reconciliation.json",
  "audit_report_id": "openhero-16ffaa7e6dc3-audit",
  "decision_status": "APPROVED",
  "assigned_specialist": "clockwork",
  "reviews": {
    "arbiter": {
      "status": "APPROVED",
      "rationale": "The static evidence supports the reference-only optimistic-state pattern and its rollback behavior. The recommendation correctly identifies missing status validation, cancellation, typed errors, and idempotency controls without treating the source behavior as runtime-confirmed.",
      "review_date": "2026-07-12"
    },
    "governor": {
      "status": "NOT_REQUIRED",
      "rationale": "The audit marks the OpenHero source as MIT and compatible. This decision permits only independent concept-level implementation, authorizes no OpenHero source reuse or third-party asset reuse, and leaves any future direct reuse subject to normal Governor review and notice preservation.",
      "review_date": "2026-07-12"
    },
    "steward": {
      "status": "APPROVED",
      "rationale": "Server-authoritative state reconciliation is broadly applicable to interactive Orchestra surfaces and supports consistency and resilience. The pattern can advance as a design concept without committing the project to a specific UI implementation.",
      "review_date": "2026-07-12"
    }
  },
  "maintainer_decision": {
    "status": "APPROVED",
    "rationale": "Approve the pattern for concept-only proposal consideration. A later Orchestra-native design must use explicit response validation, typed failures, cancellation, idempotency, deterministic rollback, and authoritative reconciliation rather than copying the audited source.",
    "decision_date": "2026-07-12"
  },
  "implementation_restriction": "CONCEPT_ONLY",
  "decision_date": "2026-07-12"
}
